{
  "mode": "single",
  "action": {
    "action_id": "proceed_to_checkout",
    "params": {},
    "priority": 5
  },
  "meta": {
    "done": true,
    "confidence": 0.9500000000000001
  },
  "thought": "Proceeding with default task action.",
  "result": {
    "ok": true,
    "cart_id": "cart_001",
    "item_count": 2,
    "subtotal": 49.98,
    "next_step_id": "step03"
  }
}