{
  "mode": "single",
  "action": {
    "action_id": "place_order",
    "params": {},
    "priority": 5
  },
  "meta": {
    "done": true,
    "confidence": 0.9500000000000001
  },
  "thought": "Proceeding with default task action.",
  "result": {
    "ok": true,
    "order_id": "ord_001",
    "status": "confirmed",
    "next_step_id": "step05"
  }
}