{
  "mode": "single",
  "action": {
    "action_id": "continue_to_payment",
    "params": {},
    "priority": 5
  },
  "meta": {
    "done": true,
    "confidence": 0.9500000000000001
  },
  "thought": "Proceeding with default task action.",
  "result": {
    "ok": true,
    "address_id": "addr_001",
    "shipping_method": "standard",
    "next_step_id": "step04"
  }
}